code,section,section_description,description
1110,A,"Agriculture, Forestry and Fishing","Growing of cereals (except rice), leguminous crops and oil seeds"
1120,A,"Agriculture, Forestry and Fishing",Growing of rice
1130,A,"Agriculture, Forestry and Fishing","Growing of vegetables and melons, roots and tubers"
1140,A,"Agriculture, Forestry and Fishing",Growing of sugar cane
1150,A,"Agriculture, Forestry and Fishing",Growing of tobacco
1160,A,"Agriculture, Forestry and Fishing",Growing of fibre crops
1190,A,"Agriculture, Forestry and Fishing",Growing of other non-perennial crops
1210,A,"Agriculture, Forestry and Fishing",Growing of grapes
1220,A,"Agriculture, Forestry and Fishing",Growing of tropical and subtropical fruits
1230,A,"Agriculture, Forestry and Fishing",Growing of citrus fruits
1240,A,"Agriculture, Forestry and Fishing",Growing of pome fruits and stone fruits
1250,A,"Agriculture, Forestry and Fishing",Growing of other tree and bush fruits and nuts
1260,A,"Agriculture, Forestry and Fishing",Growing of oleaginous fruits
1270,A,"Agriculture, Forestry and Fishing",Growing of beverage crops
1280,A,"Agriculture, Forestry and Fishing","Growing of spices, aromatic, drug and pharmaceutical crops"
1290,A,"Agriculture, Forestry and Fishing",Growing of other perennial crops
1300,A,"Agriculture, Forestry and Fishing",Plant propagation
1410,A,"Agriculture, Forestry and Fishing",Raising of dairy cattle
1420,A,"Agriculture, Forestry and Fishing",Raising of other cattle and buffaloes
1430,A,"Agriculture, Forestry and Fishing",Raising of horses and other equines
1440,A,"Agriculture, Forestry and Fishing",Raising of camels and camelids
1450,A,"Agriculture, Forestry and Fishing",Raising of sheep and goats
1460,A,"Agriculture, Forestry and Fishing",Raising of swine/pigs
1470,A,"Agriculture, Forestry and Fishing",Raising of poultry
1490,A,"Agriculture, Forestry and Fishing",Raising of other animals
1500,A,"Agriculture, Forestry and Fishing",Mixed farming
1610,A,"Agriculture, Forestry and Fishing",Support activities for crop production
1621,A,"Agriculture, Forestry and Fishing",Farm animal boarding and care
1629,A,"Agriculture, Forestry and Fishing",Support activities for animal production (other than farm animal boarding and care) n.e.c.
1630,A,"Agriculture, Forestry and Fishing",Post-harvest crop activities
1640,A,"Agriculture, Forestry and Fishing",Seed processing for propagation
1700,A,"Agriculture, Forestry and Fishing","Hunting, trapping and related service activities"
2100,A,"Agriculture, Forestry and Fishing",Silviculture and other forestry activities
2200,A,"Agriculture, Forestry and Fishing",Logging
2300,A,"Agriculture, Forestry and Fishing",Gathering of wild growing non-wood products
2400,A,"Agriculture, Forestry and Fishing",Support services to forestry
3110,A,"Agriculture, Forestry and Fishing",Marine fishing
3120,A,"Agriculture, Forestry and Fishing",Freshwater fishing
3210,A,"Agriculture, Forestry and Fishing",Marine aquaculture
3220,A,"Agriculture, Forestry and Fishing",Freshwater aquaculture
5101,B,Mining and Quarrying,Deep coal mines
5102,B,Mining and Quarrying,Open cast coal working
5200,B,Mining and Quarrying,Mining of lignite
6100,B,Mining and Quarrying,Extraction of crude petroleum
6200,B,Mining and Quarrying,Extraction of natural gas
7100,B,Mining and Quarrying,Mining of iron ores
7210,B,Mining and Quarrying,Mining of uranium and thorium ores
7290,B,Mining and Quarrying,Mining of other non-ferrous metal ores
8110,B,Mining and Quarrying,"Quarrying of ornamental and building stone, limestone, gypsum, chalk and slate"
8120,B,Mining and Quarrying,Operation of gravel and sand pits; mining of clays and kaolin
8910,B,Mining and Quarrying,Mining of chemical and fertilizer minerals
8920,B,Mining and Quarrying,Extraction of peat
8930,B,Mining and Quarrying,Extraction of salt
8990,B,Mining and Quarrying,Other mining and quarrying n.e.c.
9100,B,Mining and Quarrying,Support activities for petroleum and natural gas mining
9900,B,Mining and Quarrying,Support activities for other mining and quarrying
10110,C,Manufacturing,Processing and preserving of meat
10120,C,Manufacturing,Processing and preserving of poultry meat
10130,C,Manufacturing,Production of meat and poultry meat products
10200,C,Manufacturing,"Processing and preserving of fish, crustaceans and molluscs"
10310,C,Manufacturing,Processing and preserving of potatoes
10320,C,Manufacturing,Manufacture of fruit and vegetable juice
10390,C,Manufacturing,Other processing and preserving of fruit and vegetables
10410,C,Manufacturing,Manufacture of oils and fats
10420,C,Manufacturing,Manufacture of margarine and similar edible fats
10511,C,Manufacturing,Liquid milk and cream production
10512,C,Manufacturing,Butter and cheese production
10519,C,Manufacturing,Manufacture of other milk products
10520,C,Manufacturing,Manufacture of ice cream
10611,C,Manufacturing,Grain milling
10612,C,Manufacturing,Manufacture of breakfast cereals and cereals-based food
10620,C,Manufacturing,Manufacture of starches and starch products
10710,C,Manufacturing,Manufacture of bread; manufacture of fresh pastry goods and cakes
10720,C,Manufacturing,Manufacture of rusks and biscuits; manufacture of preserved pastry goods and cakes
10730,C,Manufacturing,"Manufacture of macaroni, noodles, couscous and similar farinaceous products"
10810,C,Manufacturing,Manufacture of sugar
10821,C,Manufacturing,Manufacture of cocoa and chocolate confectionery
10822,C,Manufacturing,Manufacture of sugar confectionery
10831,C,Manufacturing,Tea processing
10832,C,Manufacturing,Production of coffee and coffee substitutes
10840,C,Manufacturing,Manufacture of condiments and seasonings
10850,C,Manufacturing,Manufacture of prepared meals and dishes
10860,C,Manufacturing,Manufacture of homogenized food preparations and dietetic food
10890,C,Manufacturing,Manufacture of other food products n.e.c.
10910,C,Manufacturing,Manufacture of prepared feeds for farm animals
10920,C,Manufacturing,Manufacture of prepared pet foods
11010,C,Manufacturing,"Distilling, rectifying and blending of spirits"
11020,C,Manufacturing,Manufacture of wine from grape
11030,C,Manufacturing,Manufacture of cider and other fruit wines
11040,C,Manufacturing,Manufacture of other non-distilled fermented beverages
11050,C,Manufacturing,Manufacture of beer
11060,C,Manufacturing,Manufacture of malt
11070,C,Manufacturing,Manufacture of soft drinks; production of mineral waters and other bottled waters
12000,C,Manufacturing,Manufacture of tobacco products
13100,C,Manufacturing,Preparation and spinning of textile fibres
13200,C,Manufacturing,Weaving of textiles
13300,C,Manufacturing,Finishing of textiles
13910,C,Manufacturing,Manufacture of knitted and crocheted fabrics
13921,C,Manufacturing,Manufacture of soft furnishings
13922,C,Manufacturing,"manufacture of canvas goods, sacks, etc."
13923,C,Manufacturing,manufacture of household textiles
13931,C,Manufacturing,Manufacture of woven or tufted carpets and rugs
13939,C,Manufacturing,Manufacture of other carpets and rugs
13940,C,Manufacturing,"Manufacture of cordage, rope, twine and netting"
13950,C,Manufacturing,"Manufacture of non-wovens and articles made from non-wovens, except apparel"
13960,C,Manufacturing,Manufacture of other technical and industrial textiles
13990,C,Manufacturing,Manufacture of other textiles n.e.c.
14110,C,Manufacturing,Manufacture of leather clothes
14120,C,Manufacturing,Manufacture of workwear
14131,C,Manufacturing,Manufacture of other men's outerwear
14132,C,Manufacturing,Manufacture of other women's outerwear
14141,C,Manufacturing,Manufacture of men's underwear
14142,C,Manufacturing,Manufacture of women's underwear
14190,C,Manufacturing,Manufacture of other wearing apparel and accessories n.e.c.
14200,C,Manufacturing,Manufacture of articles of fur
14310,C,Manufacturing,Manufacture of knitted and crocheted hosiery
14390,C,Manufacturing,Manufacture of other knitted and crocheted apparel
15110,C,Manufacturing,Tanning and dressing of leather; dressing and dyeing of fur
15120,C,Manufacturing,"Manufacture of luggage, handbags and the like, saddlery and harness"
15200,C,Manufacturing,Manufacture of footwear
16100,C,Manufacturing,Sawmilling and planing of wood
16210,C,Manufacturing,Manufacture of veneer sheets and wood-based panels
16220,C,Manufacturing,Manufacture of assembled parquet floors
16230,C,Manufacturing,Manufacture of other builders' carpentry and joinery
16240,C,Manufacturing,Manufacture of wooden containers
16290,C,Manufacturing,"Manufacture of other products of wood; manufacture of articles of cork, straw and plaiting materials"
17110,C,Manufacturing,Manufacture of pulp
17120,C,Manufacturing,Manufacture of paper and paperboard
17211,C,Manufacturing,"Manufacture of corrugated paper and paperboard, sacks and bags"
17219,C,Manufacturing,Manufacture of other paper and paperboard containers
17220,C,Manufacturing,Manufacture of household and sanitary goods and of toilet requisites
17230,C,Manufacturing,Manufacture of paper stationery
17240,C,Manufacturing,Manufacture of wallpaper
17290,C,Manufacturing,Manufacture of other articles of paper and paperboard n.e.c.
18110,C,Manufacturing,Printing of newspapers
18121,C,Manufacturing,Manufacture of printed labels
18129,C,Manufacturing,Printing n.e.c.
18130,C,Manufacturing,Pre-press and pre-media services
18140,C,Manufacturing,Binding and related services
18201,C,Manufacturing,Reproduction of sound recording
18202,C,Manufacturing,Reproduction of video recording
18203,C,Manufacturing,Reproduction of computer media
19100,C,Manufacturing,Manufacture of coke oven products
19201,C,Manufacturing,Mineral oil refining
19209,C,Manufacturing,Other treatment of petroleum products (excluding petrochemicals manufacture)
20110,C,Manufacturing,Manufacture of industrial gases
20120,C,Manufacturing,Manufacture of dyes and pigments
20130,C,Manufacturing,Manufacture of other inorganic basic chemicals
20140,C,Manufacturing,Manufacture of other organic basic chemicals
20150,C,Manufacturing,Manufacture of fertilizers and nitrogen compounds
20160,C,Manufacturing,Manufacture of plastics in primary forms
20170,C,Manufacturing,Manufacture of synthetic rubber in primary forms
20200,C,Manufacturing,Manufacture of pesticides and other agrochemical products
20301,C,Manufacturing,"Manufacture of paints, varnishes and similar coatings, mastics and sealants"
20302,C,Manufacturing,Manufacture of printing ink
20411,C,Manufacturing,Manufacture of soap and detergents
20412,C,Manufacturing,Manufacture of cleaning and polishing preparations
20420,C,Manufacturing,Manufacture of perfumes and toilet preparations
20510,C,Manufacturing,Manufacture of explosives
20520,C,Manufacturing,Manufacture of glues
20530,C,Manufacturing,Manufacture of essential oils
20590,C,Manufacturing,Manufacture of other chemical products n.e.c.
20600,C,Manufacturing,Manufacture of man-made fibres
21100,C,Manufacturing,Manufacture of basic pharmaceutical products
21200,C,Manufacturing,Manufacture of pharmaceutical preparations
22110,C,Manufacturing,Manufacture of rubber tyres and tubes; retreading and rebuilding of rubber tyres
22190,C,Manufacturing,Manufacture of other rubber products
22210,C,Manufacturing,"Manufacture of plastic plates, sheets, tubes and profiles"
22220,C,Manufacturing,Manufacture of plastic packing goods
22230,C,Manufacturing,Manufacture of builders ware of plastic
22290,C,Manufacturing,Manufacture of other plastic products
23110,C,Manufacturing,Manufacture of flat glass
23120,C,Manufacturing,Shaping and processing of flat glass
23130,C,Manufacturing,Manufacture of hollow glass
23140,C,Manufacturing,Manufacture of glass fibres
23190,C,Manufacturing,"Manufacture and processing of other glass, including technical glassware"
23200,C,Manufacturing,Manufacture of refractory products
23310,C,Manufacturing,Manufacture of ceramic tiles and flags
23320,C,Manufacturing,"Manufacture of bricks, tiles and construction products, in baked clay"
23410,C,Manufacturing,Manufacture of ceramic household and ornamental articles
23420,C,Manufacturing,Manufacture of ceramic sanitary fixtures
23430,C,Manufacturing,Manufacture of ceramic insulators and insulating fittings
23440,C,Manufacturing,Manufacture of other technical ceramic products
23490,C,Manufacturing,Manufacture of other ceramic products n.e.c.
23510,C,Manufacturing,Manufacture of cement
23520,C,Manufacturing,Manufacture of lime and plaster
23610,C,Manufacturing,Manufacture of concrete products for construction purposes
23620,C,Manufacturing,Manufacture of plaster products for construction purposes
23630,C,Manufacturing,Manufacture of ready-mixed concrete
23640,C,Manufacturing,Manufacture of mortars
23650,C,Manufacturing,Manufacture of fibre cement
23690,C,Manufacturing,"Manufacture of other articles of concrete, plaster and cement"
23700,C,Manufacturing,"Cutting, shaping and finishing of stone"
23910,C,Manufacturing,Production of abrasive products
23990,C,Manufacturing,Manufacture of other non-metallic mineral products n.e.c.
24100,C,Manufacturing,Manufacture of basic iron and steel and of ferro-alloys
24200,C,Manufacturing,"Manufacture of tubes, pipes, hollow profiles and related fittings, of steel"
24310,C,Manufacturing,Cold drawing of bars
24320,C,Manufacturing,Cold rolling of narrow strip
24330,C,Manufacturing,Cold forming or folding
24340,C,Manufacturing,Cold drawing of wire
24410,C,Manufacturing,Precious metals production
24420,C,Manufacturing,Aluminium production
24430,C,Manufacturing,"Lead, zinc and tin production"
24440,C,Manufacturing,Copper production
24450,C,Manufacturing,Other non-ferrous metal production
24460,C,Manufacturing,Processing of nuclear fuel
24510,C,Manufacturing,Casting of iron
24520,C,Manufacturing,Casting of steel
24530,C,Manufacturing,Casting of light metals
24540,C,Manufacturing,Casting of other non-ferrous metals
25110,C,Manufacturing,Manufacture of metal structures and parts of structures
25120,C,Manufacturing,Manufacture of doors and windows of metal
25210,C,Manufacturing,Manufacture of central heating radiators and boilers
25290,C,Manufacturing,"Manufacture of other tanks, reservoirs and containers of metal"
25300,C,Manufacturing,"Manufacture of steam generators, except central heating hot water boilers"
25400,C,Manufacturing,Manufacture of weapons and ammunition
25500,C,Manufacturing,"Forging, pressing, stamping and roll-forming of metal; powder metallurgy"
25610,C,Manufacturing,Treatment and coating of metals
25620,C,Manufacturing,Machining
25710,C,Manufacturing,Manufacture of cutlery
25720,C,Manufacturing,Manufacture of locks and hinges
25730,C,Manufacturing,Manufacture of tools
25910,C,Manufacturing,Manufacture of steel drums and similar containers
25920,C,Manufacturing,Manufacture of light metal packaging
25930,C,Manufacturing,"Manufacture of wire products, chain and springs"
25940,C,Manufacturing,Manufacture of fasteners and screw machine products
25990,C,Manufacturing,Manufacture of other fabricated metal products n.e.c.
26110,C,Manufacturing,Manufacture of electronic components
26120,C,Manufacturing,Manufacture of loaded electronic boards
26200,C,Manufacturing,Manufacture of computers and peripheral equipment
26301,C,Manufacturing,Manufacture of telegraph and telephone apparatus and equipment
26309,C,Manufacturing,"Manufacture of communication equipment other than telegraph, and telephone apparatus and equipment"
26400,C,Manufacturing,Manufacture of consumer electronics
26511,C,Manufacturing,"Manufacture of electronic measuring, testing etc. equipment, not for industrial process control"
26512,C,Manufacturing,Manufacture of electronic industrial process control equipment
26513,C,Manufacturing,"Manufacture of non-electronic measuring, testing etc. equipment, not for industrial process control"
26514,C,Manufacturing,Manufacture of non-electronic industrial process control equipment
26520,C,Manufacturing,Manufacture of watches and clocks
26600,C,Manufacturing,"Manufacture of irradiation, electromedical and electrotherapeutic equipment"
26701,C,Manufacturing,Manufacture of optical precision instruments
26702,C,Manufacturing,Manufacture of photographic and cinematographic equipment
26800,C,Manufacturing,Manufacture of magnetic and optical media
27110,C,Manufacturing,"Manufacture of electric motors, generators and transformers"
27120,C,Manufacturing,Manufacture of electricity distribution and control apparatus
27200,C,Manufacturing,Manufacture of batteries and accumulators
27310,C,Manufacturing,Manufacture of fibre optic cables
27320,C,Manufacturing,Manufacture of other electronic and electric wires and cables
27330,C,Manufacturing,Manufacture of wiring devices
27400,C,Manufacturing,Manufacture of electric lighting equipment
27510,C,Manufacturing,Manufacture of electric domestic appliances
27520,C,Manufacturing,Manufacture of non-electric domestic appliances
27900,C,Manufacturing,Manufacture of other electrical equipment
28110,C,Manufacturing,"Manufacture of engines and turbines, except aircraft, vehicle and cycle engines"
28120,C,Manufacturing,Manufacture of fluid power equipment
28131,C,Manufacturing,Manufacture of pumps
28132,C,Manufacturing,Manufacture of compressors
28140,C,Manufacturing,Manufacture of taps and valves
28150,C,Manufacturing,"Manufacture of bearings, gears, gearing and driving elements"
28210,C,Manufacturing,"Manufacture of ovens, furnaces and furnace burners"
28220,C,Manufacturing,Manufacture of lifting and handling equipment
28230,C,Manufacturing,Manufacture of office machinery and equipment (except computers and peripheral equipment)
28240,C,Manufacturing,Manufacture of power-driven hand tools
28250,C,Manufacturing,Manufacture of non-domestic cooling and ventilation equipment
28290,C,Manufacturing,Manufacture of other general-purpose machinery n.e.c.
28301,C,Manufacturing,Manufacture of agricultural tractors
28302,C,Manufacturing,Manufacture of agricultural and forestry machinery other than tractors
28410,C,Manufacturing,Manufacture of metal forming machinery
28490,C,Manufacturing,Manufacture of other machine tools
28910,C,Manufacturing,Manufacture of machinery for metallurgy
28921,C,Manufacturing,Manufacture of machinery for mining
28922,C,Manufacturing,Manufacture of earthmoving equipment
28923,C,Manufacturing,Manufacture of equipment for concrete crushing and screening and roadworks
28930,C,Manufacturing,"Manufacture of machinery for food, beverage and tobacco processing"
28940,C,Manufacturing,"Manufacture of machinery for textile, apparel and leather production"
28950,C,Manufacturing,Manufacture of machinery for paper and paperboard production
28960,C,Manufacturing,Manufacture of plastics and rubber machinery
28990,C,Manufacturing,Manufacture of other special-purpose machinery n.e.c.
29100,C,Manufacturing,Manufacture of motor vehicles
29201,C,Manufacturing,Manufacture of bodies (coachwork) for motor vehicles (except caravans)
29202,C,Manufacturing,Manufacture of trailers and semi-trailers
29203,C,Manufacturing,Manufacture of caravans
29310,C,Manufacturing,Manufacture of electrical and electronic equipment for motor vehicles and their engines
29320,C,Manufacturing,Manufacture of other parts and accessories for motor vehicles
30110,C,Manufacturing,Building of ships and floating structures
30120,C,Manufacturing,Building of pleasure and sporting boats
30200,C,Manufacturing,Manufacture of railway locomotives and rolling stock
30300,C,Manufacturing,Manufacture of air and spacecraft and related machinery
30400,C,Manufacturing,Manufacture of military fighting vehicles
30910,C,Manufacturing,Manufacture of motorcycles
30920,C,Manufacturing,Manufacture of bicycles and invalid carriages
30990,C,Manufacturing,Manufacture of other transport equipment n.e.c.
31010,C,Manufacturing,Manufacture of office and shop furniture
31020,C,Manufacturing,Manufacture of kitchen furniture
31030,C,Manufacturing,Manufacture of mattresses
31090,C,Manufacturing,Manufacture of other furniture
32110,C,Manufacturing,Striking of coins
32120,C,Manufacturing,Manufacture of jewellery and related articles
32130,C,Manufacturing,Manufacture of imitation jewellery and related articles
32200,C,Manufacturing,Manufacture of musical instruments
32300,C,Manufacturing,Manufacture of sports goods
32401,C,Manufacturing,Manufacture of professional and arcade games and toys
32409,C,Manufacturing,"Manufacture of other games and toys, n.e.c."
32500,C,Manufacturing,Manufacture of medical and dental instruments and supplies
32910,C,Manufacturing,Manufacture of brooms and brushes
32990,C,Manufacturing,Other manufacturing n.e.c.
33110,C,Manufacturing,Repair of fabricated metal products
33120,C,Manufacturing,Repair of machinery
33130,C,Manufacturing,Repair of electronic and optical equipment
33140,C,Manufacturing,Repair of electrical equipment
33150,C,Manufacturing,Repair and maintenance of ships and boats
33160,C,Manufacturing,Repair and maintenance of aircraft and spacecraft
33170,C,Manufacturing,Repair and maintenance of other transport equipment n.e.c.
33190,C,Manufacturing,Repair of other equipment
33200,C,Manufacturing,Installation of industrial machinery and equipment
35110,D,"Electricity, gas, steam and air conditioning supply",Production of electricity
35120,D,"Electricity, gas, steam and air conditioning supply",Transmission of electricity
35130,D,"Electricity, gas, steam and air conditioning supply",Distribution of electricity
35140,D,"Electricity, gas, steam and air conditioning supply",Trade of electricity
35210,D,"Electricity, gas, steam and air conditioning supply",Manufacture of gas
35220,D,"Electricity, gas, steam and air conditioning supply",Distribution of gaseous fuels through mains
35230,D,"Electricity, gas, steam and air conditioning supply",Trade of gas through mains
35300,D,"Electricity, gas, steam and air conditioning supply",Steam and air conditioning supply
36000,E,"Water supply, sewerage, waste management and remediation activities","Water collection, treatment and supply"
37000,E,"Water supply, sewerage, waste management and remediation activities",Sewerage
38110,E,"Water supply, sewerage, waste management and remediation activities",Collection of non-hazardous waste
38120,E,"Water supply, sewerage, waste management and remediation activities",Collection of hazardous waste
38210,E,"Water supply, sewerage, waste management and remediation activities",Treatment and disposal of non-hazardous waste
38220,E,"Water supply, sewerage, waste management and remediation activities",Treatment and disposal of hazardous waste
38310,E,"Water supply, sewerage, waste management and remediation activities",Dismantling of wrecks
38320,E,"Water supply, sewerage, waste management and remediation activities",Recovery of sorted materials
39000,E,"Water supply, sewerage, waste management and remediation activities",Remediation activities and other waste management services
41100,F,Construction,Development of building projects
41201,F,Construction,Construction of commercial buildings
41202,F,Construction,Construction of domestic buildings
42110,F,Construction,Construction of roads and motorways
42120,F,Construction,Construction of railways and underground railways
42130,F,Construction,Construction of bridges and tunnels
42210,F,Construction,Construction of utility projects for fluids
42220,F,Construction,Construction of utility projects for electricity and telecommunications
42910,F,Construction,Construction of water projects
42990,F,Construction,Construction of other civil engineering projects n.e.c.
43110,F,Construction,Demolition
43120,F,Construction,Site preparation
43130,F,Construction,Test drilling and boring
43210,F,Construction,Electrical installation
43220,F,Construction,"Plumbing, heat and air-conditioning installation"
43290,F,Construction,Other construction installation
43310,F,Construction,Plastering
43320,F,Construction,Joinery installation
43330,F,Construction,Floor and wall covering
43341,F,Construction,Painting
43342,F,Construction,Glazing
43390,F,Construction,Other building completion and finishing
43910,F,Construction,Roofing activities
43991,F,Construction,Scaffold erection
43999,F,Construction,Other specialised construction activities n.e.c.
45111,G,Wholesale and retail trade; repair of motor vehicles and motorcycles,Sale of new cars and light motor vehicles
45112,G,Wholesale and retail trade; repair of motor vehicles and motorcycles,Sale of used cars and light motor vehicles
45190,G,Wholesale and retail trade; repair of motor vehicles and motorcycles,Sale of other motor vehicles
45200,G,Wholesale and retail trade; repair of motor vehicles and motorcycles,Maintenance and repair of motor vehicles
45310,G,Wholesale and retail trade; repair of motor vehicles and motorcycles,Wholesale trade of motor vehicle parts and accessories
45320,G,Wholesale and retail trade; repair of motor vehicles and motorcycles,Retail trade of motor vehicle parts and accessories
45400,G,Wholesale and retail trade; repair of motor vehicles and motorcycles,"Sale, maintenance and repair of motorcycles and related parts and accessories"
46110,G,Wholesale and retail trade; repair of motor vehicles and motorcycles,"Agents selling agricultural raw materials, livestock, textile raw materials and semi-finished goods"
46120,G,Wholesale and retail trade; repair of motor vehicles and motorcycles,"Agents involved in the sale of fuels, ores, metals and industrial chemicals"
46130,G,Wholesale and retail trade; repair of motor vehicles and motorcycles,Agents involved in the sale of timber and building materials
46140,G,Wholesale and retail trade; repair of motor vehicles and motorcycles,"Agents involved in the sale of machinery, industrial equipment, ships and aircraft"
46150,G,Wholesale and retail trade; repair of motor vehicles and motorcycles,"Agents involved in the sale of furniture, household goods, hardware and ironmongery"
